tweet_id,timestamp,source,text
685198997565345792,2016-01-07 20:39:06+00:00,"<a href=""http://twitter.com/download/iphone"" rel=""nofollow"">Twitter for iPhone</a>",This is Alfie. That is his time machine. He's very proud of it. Without him life as we know it would not exist 11/10 https://t.co/530Yfbl5xo
685169283572338688,2016-01-07 18:41:01+00:00,"<a href=""http://twitter.com/download/iphone"" rel=""nofollow"">Twitter for iPhone</a>",Meet Gerbald. He just found out he's adopted. Poor pupper. Snazzy tongue tho. 11/10 would hold close in time of need https://t.co/UfGkB9Wrud
684959798585110529,2016-01-07 04:48:36+00:00,"<a href=""http://twitter.com/download/iphone"" rel=""nofollow"">Twitter for iPhone</a>",This is Jerry. He's a neat dog. No legs (tragic). Has more horns than a dog usually does. Bark is unique af. 5/10 https://t.co/85q7xlplsJ
684940049151070208,2016-01-07 03:30:07+00:00,"<a href=""http://twitter.com/download/iphone"" rel=""nofollow"">Twitter for iPhone</a>",This is Oreo. She's a photographer and a model. Living a double pupple life. 12/10 such talent much cute would pet https://t.co/zNeLxJeAoL
684926975086034944,2016-01-07 02:38:10+00:00,"<a href=""http://twitter.com/download/iphone"" rel=""nofollow"">Twitter for iPhone</a>",Meet Bruiser &amp; Charlie. They are the best of pals. Been through it all together. Both 11/10. 1 like=1 friendship https://t.co/PEXHuvSVD4
684914660081053696,2016-01-07 01:49:14+00:00,"<a href=""http://twitter.com/download/iphone"" rel=""nofollow"">Twitter for iPhone</a>","""Hello yes I'll just get one of each color thanks"" 12/10 for all https://t.co/AMDsllQs7a"
684902183876321280,2016-01-07 00:59:40+00:00,"<a href=""http://twitter.com/download/iphone"" rel=""nofollow"">Twitter for iPhone</a>",This is Perry. He's an Augustus Gloopster. Very condescending. Makes up for it with the sneaky tongue slip. 11/10 https://t.co/JVvIrUmTkR
684880619965411328,2016-01-06 23:33:58+00:00,"<a href=""http://twitter.com/download/iphone"" rel=""nofollow"">Twitter for iPhone</a>",Here we have a basking dino pupper. Looks powerful. Occasionally shits eggs. Doesn't want the holidays to end. 5/10 https://t.co/DnNweb5eTO
684800227459624960,2016-01-06 18:14:31+00:00,"<a href=""http://twitter.com/download/iphone"" rel=""nofollow"">Twitter for iPhone</a>",Meet Theodore. He's dapper as hell. Probably owns horses. Uses 'summer' as a verb. Often quotes philosophers. 11/10 https://t.co/J3Ld4fRbSy
684594889858887680,2016-01-06 04:38:35+00:00,"<a href=""http://twitter.com/download/iphone"" rel=""nofollow"">Twitter for iPhone</a>","""FOR THE LAST TIME I DON'T WANNA PLAY TWISTER ALL THE SPOTS ARE GREY DAMN IT CINDY"" ...10/10 https://t.co/uhQNehTpIu"
684567543613382656,2016-01-06 02:49:55+00:00,"<a href=""http://twitter.com/download/iphone"" rel=""nofollow"">Twitter for iPhone</a>",This is Bobby. He doesn't give a damn about personal space. Convinced he called shotgun first. 4/10 not the best dog https://t.co/b8XW69gSaU
684481074559381504,2016-01-05 21:06:19+00:00,"<a href=""http://twitter.com/download/iphone"" rel=""nofollow"">Twitter for iPhone</a>",Meet Pippa. She's an Elfin High Feta. Compact af. Easy to transport. Great for vacations. 10/10 would keep in pocket https://t.co/nBtDeZ4yAb
684460069371654144,2016-01-05 19:42:51+00:00,"<a href=""http://twitter.com/download/iphone"" rel=""nofollow"">Twitter for iPhone</a>",This is Jeph. He's a Western Sagittarius Dookmarriot. Frightened by leaf. Caught him off guard. 10/10 calm down Jeph https://t.co/bicyOV6lju
684241637099323392,2016-01-05 05:14:53+00:00,"<a href=""http://twitter.com/download/iphone"" rel=""nofollow"">Twitter for iPhone</a>",This is Obi. He got camera shy. 12/10 https://t.co/feiPiq7z94
684200372118904832,2016-01-05 02:30:55+00:00,"<a href=""http://twitter.com/download/iphone"" rel=""nofollow"">Twitter for iPhone</a>",Gang of fearless hoofed puppers here. Straight savages. Elevated for extra terror. Front one has killed before 6/10s https://t.co/jkCb25OWfh
684195085588783105,2016-01-05 02:09:54+00:00,"<a href=""http://twitter.com/download/iphone"" rel=""nofollow"">Twitter for iPhone</a>",This is Tino. He really likes corndogs. 9/10 https://t.co/cUxGtnBfc2
684188786104872960,2016-01-05 01:44:52+00:00,"<a href=""http://twitter.com/download/iphone"" rel=""nofollow"">Twitter for iPhone</a>","""Yo Boomer I'm taking a selfie, grab your stick""
""Ok make sure to get this rad hole I just dug in there""

Both 10/10 https://t.co/e0gbl9VFpA"
684177701129875456,2016-01-05 01:00:50+00:00,"<a href=""http://twitter.com/download/iphone"" rel=""nofollow"">Twitter for iPhone</a>",This is Kulet. She's very proud of the flower she picked. Loves it dearly. 10/10 now I want a flower https://t.co/myUUwqJIs7
684122891630342144,2016-01-04 21:23:02+00:00,"<a href=""http://twitter.com/download/iphone"" rel=""nofollow"">Twitter for iPhone</a>",Heartwarming scene of two pups that want nothing more than to be together. Touching af. Great tongue. Both 11/10 https://t.co/k32mSlRx0j
684097758874210310,2016-01-04 19:43:10+00:00,"<a href=""http://twitter.com/download/iphone"" rel=""nofollow"">Twitter for iPhone</a>",Say hello to Lupe. This is how she sleeps. 10/10 impressive really https://t.co/Fz6iZWlk8C
683857920510050305,2016-01-04 03:50:08+00:00,"<a href=""http://twitter.com/download/iphone"" rel=""nofollow"">Twitter for iPhone</a>",Meet Sadie. She fell asleep on the beach and her friends buried her. 10/10 can't trust fellow puppers these days https://t.co/LoKVvc1xAW
683852578183077888,2016-01-04 03:28:54+00:00,"<a href=""http://twitter.com/download/iphone"" rel=""nofollow"">Twitter for iPhone</a>","Say hello to Tiger. He's a penbroke (little dog pun for ya, no need to applaud I know it was good) 10/10 good dog https://t.co/Yei0HzS3JN"
683849932751646720,2016-01-04 03:18:23+00:00,"<a href=""http://twitter.com/download/iphone"" rel=""nofollow"">Twitter for iPhone</a>",This is Jiminy. He's not the brightest dog. Needs to lay off the kibble. 5/10 still petable https://t.co/omln4LOy1x
683834909291606017,2016-01-04 02:18:42+00:00,"<a href=""http://twitter.com/download/iphone"" rel=""nofollow"">Twitter for iPhone</a>",Here we see a faulty pupper. Might need to replace batteries. Try turning off &amp; back on again. 9/10 would still pet https://t.co/O1E4AtHVxO
683828599284170753,2016-01-04 01:53:37+00:00,"<a href=""http://twitter.com/download/iphone"" rel=""nofollow"">Twitter for iPhone</a>",Breathtaking pupper here. Should be on the cover of Dogue. Top-notch tongue. Appears considerably fluffy. 12/10 https://t.co/Eeh3yfdglS
683773439333797890,2016-01-03 22:14:26+00:00,"<a href=""http://twitter.com/download/iphone"" rel=""nofollow"">Twitter for iPhone</a>",This is Buddy. He's gaining strength. Currently an F4 tornado with wind speeds up to 260mph. Very devastating. 9/10 https://t.co/qipZbshNsR
683742671509258241,2016-01-03 20:12:10+00:00,"<a href=""http://twitter.com/download/iphone"" rel=""nofollow"">Twitter for iPhone</a>",Meet Sebastian. He's a womanizer. Romantic af. Always covered in flower petals. Also a poet. 11/10 dreamy as hell https://t.co/eoL1bCpWCg
683498322573824003,2016-01-03 04:01:13+00:00,"<a href=""http://twitter.com/download/iphone"" rel=""nofollow"">Twitter for iPhone</a>",This is Griffin. He's desperate for both a physical and emotion connection. 11/10 I'd hug the hell out of Griffin https://t.co/ObWcOEekt0
683481228088049664,2016-01-03 02:53:17+00:00,"<a href=""http://twitter.com/download/iphone"" rel=""nofollow"">Twitter for iPhone</a>",Meet Banjo. He's a Peppercorn Shoop Da Whoop. Nails look lethal. Skeptical of luminescent orb 11/10 stay woke pupper https://t.co/H7NZFumpKq
683462770029932544,2016-01-03 01:39:57+00:00,"<a href=""http://twitter.com/download/iphone"" rel=""nofollow"">Twitter for iPhone</a>","""Hello forest pupper I am house pupper welcome to my abode"" (8/10 for both) https://t.co/qFD8217fUT"
683449695444799489,2016-01-03 00:47:59+00:00,"<a href=""http://twitter.com/download/iphone"" rel=""nofollow"">Twitter for iPhone</a>",I just want to be friends with this dog. Appears to be into the sports. A true brobean. 10/10 would introduce to mom https://t.co/1Z7Q6svWpe
683391852557561860,2016-01-02 20:58:09+00:00,"<a href=""http://twitter.com/download/iphone"" rel=""nofollow"">Twitter for iPhone</a>","Say hello to Jack (pronounced ""Kevin""). He's a Virgo Episcopalian. Can summon rainbows. 11/10 magical as hell https://t.co/YHXrdUTHd6"
683357973142474752,2016-01-02 18:43:31+00:00,"<a href=""http://twitter.com/download/iphone"" rel=""nofollow"">Twitter for iPhone</a>","""Have a seat, son. There are some things we need to discuss"" 10/10 https://t.co/g4G5tvfTVd"
683142553609318400,2016-01-02 04:27:31+00:00,"<a href=""http://twitter.com/download/iphone"" rel=""nofollow"">Twitter for iPhone</a>",Meet Brandy. She's a member of the Bloods. Menacing criminal pupper. Soft spot for flowers tho. 9/10 pet w caution https://t.co/hhIA3coiAJ
683111407806746624,2016-01-02 02:23:45+00:00,"<a href=""http://twitter.com/download/iphone"" rel=""nofollow"">Twitter for iPhone</a>",This is Larry. He thought the New Year's parties were tonight. 10/10 poor pupper. Maybe next year https://t.co/h3X0jK8MVM
683098815881154561,2016-01-02 01:33:43+00:00,"<a href=""http://twitter.com/download/iphone"" rel=""nofollow"">Twitter for iPhone</a>",aahhhhkslaldhwnxmzbbs 12/10 for being da smooshiest https://t.co/UOPdXmUz4H
683078886620553216,2016-01-02 00:14:32+00:00,"<a href=""http://twitter.com/download/iphone"" rel=""nofollow"">Twitter for iPhone</a>",Here we see a nifty leaping pupper. Feet look deadly. Sad that the holidays are over. 9/10 undeniably huggable https://t.co/ny8mnXhGOW
683030066213818368,2016-01-01 21:00:32+00:00,"<a href=""http://twitter.com/download/iphone"" rel=""nofollow"">Twitter for iPhone</a>",This is Lulu. She's contemplating all her unreached 2015 goals and daydreaming of a more efficient tomorrow. 10/10 https://t.co/h3ScYuz77J
682788441537560576,2016-01-01 05:00:24+00:00,"<a href=""http://twitter.com/download/iphone"" rel=""nofollow"">Twitter for iPhone</a>","Happy New Year from your fav holiday squad! ðŸŽ‰ 12/10 for all

Here's to a pupper-filled year ðŸ»ðŸ¶ðŸ¶ðŸ¶ https://t.co/ZSdEj59FGf"
682750546109968385,2016-01-01 02:29:49+00:00,"<a href=""http://twitter.com/download/iphone"" rel=""nofollow"">Twitter for iPhone</a>",Meet Taco. He's a speckled Garnier Fructis. Loves to shadow box. Ears out of control. Friend clearly impressed 9/10 https://t.co/85X1GHohFr
682697186228989953,2015-12-31 22:57:47+00:00,"<a href=""http://twitter.com/download/iphone"" rel=""nofollow"">Twitter for iPhone</a>",NAAAAAAA ZAPENYAAAAA MABADI-CHIBAWAAA 12/10 https://t.co/Ny4iM6FDtz
682662431982772225,2015-12-31 20:39:41+00:00,"<a href=""http://twitter.com/download/iphone"" rel=""nofollow"">Twitter for iPhone</a>",Meet Joey and Izzy. Joey only has one ear that works and Izzy wants 2015 to be over already. Both great pups. 11/10s https://t.co/WgQTIQ93BB
682638830361513985,2015-12-31 19:05:54+00:00,"<a href=""http://twitter.com/download/iphone"" rel=""nofollow"">Twitter for iPhone</a>",I have no words. Just a magnificent pup. 12/10 https://t.co/viwWHZgX8j
682429480204398592,2015-12-31 05:14:01+00:00,"<a href=""http://twitter.com/download/iphone"" rel=""nofollow"">Twitter for iPhone</a>","I know we joke around on here, but this is getting really frustrating. We rate dogs. Not T-Rex. Thank you... 8/10 https://t.co/5aFw7SWyxU"
682406705142087680,2015-12-31 03:43:31+00:00,"<a href=""http://twitter.com/download/iphone"" rel=""nofollow"">Twitter for iPhone</a>",This is Patrick. He's a bigass pupper. 7/10 https://t.co/J9DXBFoAQe
682393905736888321,2015-12-31 02:52:40+00:00,"<a href=""http://twitter.com/download/iphone"" rel=""nofollow"">Twitter for iPhone</a>",This is Kreg. He's riding an invisible jet ski. 11/10 that's downright legendary https://t.co/BA5AV5dx6Y
682389078323662849,2015-12-31 02:33:29+00:00,"<a href=""http://twitter.com/download/iphone"" rel=""nofollow"">Twitter for iPhone</a>","Meet Brody. He's a Downton Abbey Falsetto. Addicted to grating cheese. He says he can stop but we know he can't
9/10 https://t.co/vBeiQq6SaZ"
682303737705140231,2015-12-30 20:54:22+00:00,"<a href=""http://twitter.com/download/iphone"" rel=""nofollow"">Twitter for iPhone</a>",This is Todo. He's screaming because he doesn't want to wear his sweater or a seat belt. 9/10 gotta buckle up pup https://t.co/Nm8Spw4HbD
682259524040966145,2015-12-30 17:58:40+00:00,"<a href=""http://twitter.com/download/iphone"" rel=""nofollow"">Twitter for iPhone</a>",Meet Jax. He's an Iglesias Hufflepoof. Quite the jokester. Takes it too far sometimes. Can be very hurtful. 9/10 https://t.co/i5TeG0KYcW
682242692827447297,2015-12-30 16:51:48+00:00,"<a href=""http://twitter.com/download/iphone"" rel=""nofollow"">Twitter for iPhone</a>",This is Samson. He patrols his waters on the back of his massive shielded battle dog. 11/10 https://t.co/f8dVgDYDFf
682059653698686977,2015-12-30 04:44:28+00:00,"<a href=""http://twitter.com/download/iphone"" rel=""nofollow"">Twitter for iPhone</a>",This is Tess. Her main passions are shelves and baking too many cookies. 11/10 https://t.co/IriJlVZ6m4
682047327939461121,2015-12-30 03:55:29+00:00,"<a href=""http://twitter.com/download/iphone"" rel=""nofollow"">Twitter for iPhone</a>",We normally don't rate bears but this one seems nice. Her name is Thea. Appears rather fluffy. 10/10 good bear https://t.co/fZc7MixeeT
682032003584274432,2015-12-30 02:54:35+00:00,"<a href=""http://twitter.com/download/iphone"" rel=""nofollow"">Twitter for iPhone</a>",This is Ulysses. He likes holding hands and his eyes are magic. 11/10 https://t.co/gPmJHmtgak
682003177596559360,2015-12-30 01:00:03+00:00,"<a href=""http://twitter.com/download/iphone"" rel=""nofollow"">Twitter for iPhone</a>",Unique dog here. Wrinkly as hell. Weird segmented neck. Finger on fire. Doesn't seem to notice. 5/10 might still pet https://t.co/Hy9La4xNX3
681981167097122816,2015-12-29 23:32:35+00:00,"<a href=""http://twitter.com/download/iphone"" rel=""nofollow"">Twitter for iPhone</a>",This is Jimothy. He's a Trinidad Poliwhirl. Father was a velociraptor. Exceptionally unamused. 12/10 would adopt https://t.co/VwdIk0OwVx
681891461017812993,2015-12-29 17:36:07+00:00,"<a href=""http://twitter.com/download/iphone"" rel=""nofollow"">Twitter for iPhone</a>",Say hello to Charlie. He's scholarly af. Quite intimidating with all his pupper knowledge 10/10 even built that fire https://t.co/9KThv6z8u5
681694085539872773,2015-12-29 04:31:49+00:00,"<a href=""http://twitter.com/download/iphone"" rel=""nofollow"">Twitter for iPhone</a>",This is Bo. He's a Benedoop Cumbersnatch. Seems frustrated with own feet. Portable as hell. 11/10 very solid pupper https://t.co/TONMhRoQh7
681679526984871937,2015-12-29 03:33:58+00:00,"<a href=""http://twitter.com/download/iphone"" rel=""nofollow"">Twitter for iPhone</a>",Can you spot Toby the guilty pupper? 7/10 would be higher but he made quite the mess shredding his stuffed pals https://t.co/3uCcDEJLXs
681654059175129088,2015-12-29 01:52:46+00:00,"<a href=""http://twitter.com/download/iphone"" rel=""nofollow"">Twitter for iPhone</a>",This is Toffee. He's a happy pupper. Appears dangerously fluffy. Extraordinarily spherical. 12/10 would pet firmly https://t.co/oEXEKt3MHu
681610798867845120,2015-12-28 23:00:52+00:00,"<a href=""http://twitter.com/download/iphone"" rel=""nofollow"">Twitter for iPhone</a>",*collapses* 12/10 https://t.co/C7M8mnzHIK
681579835668455424,2015-12-28 20:57:50+00:00,"<a href=""http://twitter.com/download/iphone"" rel=""nofollow"">Twitter for iPhone</a>",This is Apollo. He thought you weren't coming back so he had a mental breakdown. 8/10 we've all been there https://t.co/ojUBrDCHLT
681523177663676416,2015-12-28 17:12:42+00:00,"<a href=""http://twitter.com/download/iphone"" rel=""nofollow"">Twitter for iPhone</a>",This is Carly. She's actually 2 dogs fused together. Very innovative. Probably has superpowers. 12/10 for double dog https://t.co/GQn2IopLud
681339448655802368,2015-12-28 05:02:37+00:00,"<a href=""http://twitter.com/download/iphone"" rel=""nofollow"">Twitter for iPhone</a>",This is Asher. He's not wearing a seatbelt or keeping both paws on the wheel. Absolute menace on the roadways. 9/10 https://t.co/V3SWuHACkh
681320187870711809,2015-12-28 03:46:05+00:00,"<a href=""http://twitter.com/download/iphone"" rel=""nofollow"">Twitter for iPhone</a>",This is Glacier. He's a very happy pup. Loves to sing in the sunlight. 11/10 https://t.co/jTBPqKgkz7
681302363064414209,2015-12-28 02:35:15+00:00,"<a href=""http://twitter.com/download/iphone"" rel=""nofollow"">Twitter for iPhone</a>",This is Chuck. He's a neat dog. Very flexible. Trapped in a glass case of emotion. Devastatingly unfluffy 3/10 https://t.co/YqbU9xHV3p
681297372102656000,2015-12-28 02:15:26+00:00,"<a href=""http://twitter.com/download/iphone"" rel=""nofollow"">Twitter for iPhone</a>","This is actually a lion. We only rate dogs. For the last time please only send dogs. Thank u.
12/10 would still pet https://t.co/Pp26dMQxap"
681281657291280384,2015-12-28 01:12:59+00:00,"<a href=""http://twitter.com/download/iphone"" rel=""nofollow"">Twitter for iPhone</a>",Meet Sarge. His parents signed him up for dancing lessons but his true passion is roller coasters 11/10 very petable https://t.co/KvVoBIgkje
681261549936340994,2015-12-27 23:53:05+00:00,"<a href=""http://twitter.com/download/iphone"" rel=""nofollow"">Twitter for iPhone</a>",Say hello to Panda. He's a Quackadilly Shooster. Not amused by your fake ball throwing motion. 9/10 would hug lots https://t.co/wL1iDvbcVk
681242418453299201,2015-12-27 22:37:04+00:00,"<a href=""http://twitter.com/download/iphone"" rel=""nofollow"">Twitter for iPhone</a>",This is Champ. He's being sacrificed to the Aztec sun god Huitzilopochtli. So sad. 10/10 Champ doesn't deserve this https://t.co/VGsziXImoy
681231109724700672,2015-12-27 21:52:07+00:00,"<a href=""http://twitter.com/download/iphone"" rel=""nofollow"">Twitter for iPhone</a>",I just love this pic. 11/10 this pupper is going places https://t.co/P16uhh1PbI
681193455364796417,2015-12-27 19:22:30+00:00,"<a href=""http://twitter.com/download/iphone"" rel=""nofollow"">Twitter for iPhone</a>",This is Aspen. He's astronomically fluffy. I wouldn't stop petting this dog if the world was ending around me 11/10 https://t.co/oBlgL9nxpx
680970795137544192,2015-12-27 04:37:44+00:00,"<a href=""http://twitter.com/download/iphone"" rel=""nofollow"">Twitter for iPhone</a>",I thought I made this very clear. We only rate dogs. Stop sending other things like this shark. Thank you... 9/10 https://t.co/CXSJZ4Stk3
680959110691590145,2015-12-27 03:51:18+00:00,"<a href=""http://twitter.com/download/iphone"" rel=""nofollow"">Twitter for iPhone</a>",This is Ozzie. He was doing fine until he lost traction in those festive socks. Now he's tired. 9/10 still killin it https://t.co/u4FYdIRKnY
680940246314430465,2015-12-27 02:36:20+00:00,"<a href=""http://twitter.com/download/iphone"" rel=""nofollow"">Twitter for iPhone</a>",This is Alice. She's an idiot. 4/10 https://t.co/VQXdwJfkyS
680934982542561280,2015-12-27 02:15:25+00:00,"<a href=""http://twitter.com/download/iphone"" rel=""nofollow"">Twitter for iPhone</a>",Say hello to Sadie. She's a Tortellini Sidewinder. Very jubilant pup. Seems loyal. Leaves on point. 10/10 petable af https://t.co/g2bTu4ayPl
680913438424612864,2015-12-27 00:49:49+00:00,"<a href=""http://twitter.com/download/iphone"" rel=""nofollow"">Twitter for iPhone</a>",Meet Griswold. He's dapper as hell. Already pumped for next Christmas. 11/10 https://t.co/5NrpNDyFzN
680889648562991104,2015-12-26 23:15:17+00:00,"<a href=""http://twitter.com/download/iphone"" rel=""nofollow"">Twitter for iPhone</a>",This is Cheesy. It's her birthday. She's patiently waiting to eat her party muffin. 9/10 happy birthday pup https://t.co/cH2H7mch2H
680836378243002368,2015-12-26 19:43:36+00:00,"<a href=""http://twitter.com/download/iphone"" rel=""nofollow"">Twitter for iPhone</a>",This is Ellie. She's secretly ferocious. 12/10 very deadly pupper https://t.co/BF4BW8LUgb
680801747103793152,2015-12-26 17:25:59+00:00,"<a href=""http://twitter.com/download/iphone"" rel=""nofollow"">Twitter for iPhone</a>",Great picture here. Dog on the right panicked &amp; forgot about his tongue. Middle green dog must've fainted. All 10/10 https://t.co/31npKUAox0
680798457301471234,2015-12-26 17:12:55+00:00,"<a href=""http://twitter.com/download/iphone"" rel=""nofollow"">Twitter for iPhone</a>",Say hello to Moofasa. He must be a powerful dog. Fenced in for your protection. Just got his ear pierced. 6/10 https://t.co/w6fRfQ3RXD
680609293079592961,2015-12-26 04:41:15+00:00,"<a href=""http://twitter.com/download/iphone"" rel=""nofollow"">Twitter for iPhone</a>",This is Brody. That is his chair. He loves his chair. Never leaves it. 9/10 might be stuck actually https://t.co/WvJRg0XJit
680583894916304897,2015-12-26 03:00:19+00:00,"<a href=""http://twitter.com/download/iphone"" rel=""nofollow"">Twitter for iPhone</a>",This is Penny. Her tennis ball slowly rolled down her cone and into the pool. 8/10 bad things happen to good puppers https://t.co/YNWU7LeFgg
680497766108381184,2015-12-25 21:18:05+00:00,"<a href=""http://twitter.com/download/iphone"" rel=""nofollow"">Twitter for iPhone</a>",Meet Percy. He's a Latvian Yuletide Heineken. Refuses to take off sweater. Kinda feisty. 12/10 would keep in pocket https://t.co/QGM5Fcuv7s
680494726643068929,2015-12-25 21:06:00+00:00,"<a href=""http://twitter.com/download/iphone"" rel=""nofollow"">Twitter for iPhone</a>",Here we have uncovered an entire battalion of holiday puppers. Average of 11.26/10 https://t.co/eNm2S6p9BD
680473011644985345,2015-12-25 19:39:43+00:00,"<a href=""http://twitter.com/download/iphone"" rel=""nofollow"">Twitter for iPhone</a>","This is Hector. He thinks he's a hammer. Silly Hector. You're a pupper, not a hammer. 10/10 https://t.co/OdUFuZIXiI"
680440374763077632,2015-12-25 17:30:01+00:00,"<a href=""http://twitter.com/download/iphone"" rel=""nofollow"">Twitter for iPhone</a>",Merry Christmas. My gift to you is this tiny unicorn running into a wall in slow motion. 11/10 https://t.co/UKqIAnR3He
680221482581123072,2015-12-25 03:00:14+00:00,"<a href=""http://twitter.com/download/iphone"" rel=""nofollow"">Twitter for iPhone</a>",This is CeCe. She's patiently waiting for Santa. 10/10 https://t.co/ZJUypFFwvg
680206703334408192,2015-12-25 02:01:30+00:00,"<a href=""http://twitter.com/download/iphone"" rel=""nofollow"">Twitter for iPhone</a>",I hope everyone enjoys this picture as much as I do. This is Toby. 12/10 https://t.co/vHnu1g9EJm
680191257256136705,2015-12-25 01:00:07+00:00,"<a href=""http://twitter.com/download/iphone"" rel=""nofollow"">Twitter for iPhone</a>",Here's a sleepy Christmas pupper 11/10 https://t.co/KXg0f8GNQ9
680176173301628928,2015-12-25 00:00:11+00:00,"<a href=""http://twitter.com/download/iphone"" rel=""nofollow"">Twitter for iPhone</a>",This pupper is patiently waiting to scare the shit out of Santa. 10/10 https://t.co/NhXo67K6yt
680161097740095489,2015-12-24 23:00:17+00:00,"<a href=""http://twitter.com/download/iphone"" rel=""nofollow"">Twitter for iPhone</a>",Meet Goliath. He's an example of irony. Head is phenomenally round. Wants to be an ornament. 12/10 would hug gently https://t.co/72Dil0Aktw
680145970311643136,2015-12-24 22:00:10+00:00,"<a href=""http://twitter.com/download/iphone"" rel=""nofollow"">Twitter for iPhone</a>",Say hello to Kawhi. He was doing fine until his hat fell off. He got it back though. 10/10 deep breaths pupper https://t.co/N5pM6WBx7e
680130881361686529,2015-12-24 21:00:12+00:00,"<a href=""http://twitter.com/download/iphone"" rel=""nofollow"">Twitter for iPhone</a>",This is Reggie. His Santa hat is a little big. 10/10 he's still having fun https://t.co/w0dcGXq7qK
680115823365742593,2015-12-24 20:00:22+00:00,"<a href=""http://twitter.com/download/iphone"" rel=""nofollow"">Twitter for iPhone</a>",This is Ozzy. He woke up 2 minutes before he had to be ready for the Christmas party. 9/10 classic Ozzy https://t.co/Kt9vmw0Fap
680100725817409536,2015-12-24 19:00:23+00:00,"<a href=""https://about.twitter.com/products/tweetdeck"" rel=""nofollow"">TweetDeck</a>",This pupper is not coming inside until she catches a snowflake on her tongue. 11/10 the determination is palpable https://t.co/lvMYbmKq8H
680085611152338944,2015-12-24 18:00:19+00:00,"<a href=""https://about.twitter.com/products/tweetdeck"" rel=""nofollow"">TweetDeck</a>",This is by far the most coordinated series of pictures I was sent. Downright impressive in every way. 12/10 for all https://t.co/etzLo3sdZE
680070545539371008,2015-12-24 17:00:27+00:00,"<a href=""https://about.twitter.com/products/tweetdeck"" rel=""nofollow"">TweetDeck</a>",Say hello to Emmie. She's trapped in an ornament. Tragic af. Looks pretty content tho. Maybe it's meant to be. 9/10 https://t.co/Fh7geodBCU
679877062409191424,2015-12-24 04:11:37+00:00,"<a href=""http://twitter.com/download/iphone"" rel=""nofollow"">Twitter for iPhone</a>",Meet Penelope. She's a bacon frise. Total babe (lol get it like the movie). Doesn't bark tho. 5/10 very average dog https://t.co/SDcQYg0HSZ
679862121895714818,2015-12-24 03:12:15+00:00,"<a href=""http://twitter.com/download/iphone"" rel=""nofollow"">Twitter for iPhone</a>","""Dammit hooman I'm jus trynna lik the fler"" 11/10 https://t.co/eRZRI8OTj7"
679854723806179328,2015-12-24 02:42:51+00:00,"<a href=""http://twitter.com/download/iphone"" rel=""nofollow"">Twitter for iPhone</a>",This is Bruce. He's a rare pup. Covered in Frosted Flakes. Nifty gold teeth. Overall good dog. 7/10 would pet firmly https://t.co/RtxxACzZ8A
