tweet_id,timestamp,source,text
827933404142436356,2017-02-04 17:34:40+00:00,"<a href=""http://twitter.com/download/iphone"" rel=""nofollow"">Twitter for iPhone</a>",This is Kona. Yesterday she stopped by the department to see what it takes to be a police pupper. 12/10 vest was only a smidge too big https://t.co/j8D3PQJvpJ
827653905312006145,2017-02-03 23:04:02+00:00,"<a href=""http://twitter.com/download/iphone"" rel=""nofollow"">Twitter for iPhone</a>",This is Boots. She doesn't know what to do with treats so she just holds them. Very good girl. 12/10 would give more treats https://t.co/eAA8lratd3
827600520311402496,2017-02-03 19:31:54+00:00,"<a href=""http://twitter.com/download/iphone"" rel=""nofollow"">Twitter for iPhone</a>",Meet Tucker. It's his birthday. He's pupset with you because you're too busy playing @GoodDogsGame to celebrate. 13/10 would put down phone https://t.co/vrppizPGdb
827324948884643840,2017-02-03 01:16:53+00:00,"<a href=""http://twitter.com/download/iphone"" rel=""nofollow"">Twitter for iPhone</a>","This is Ralphie. He's being treated for an overactive funny bone, which is no joke. 12/10 would try to pet with a straight face https://t.co/UU3KqQF5n5"
827199976799354881,2017-02-02 17:00:17+00:00,"<a href=""http://twitter.com/download/iphone"" rel=""nofollow"">Twitter for iPhone</a>",This is Charlie. He wins every game of chess he plays. Won't let opponent pet him until they forfeit. 13/10 you win again Charlie https://t.co/UkyQibIBzZ
826958653328592898,2017-02-02 01:01:21+00:00,"<a href=""http://twitter.com/download/iphone"" rel=""nofollow"">Twitter for iPhone</a>",This is Loki. He smiles like Elvis. Ain't nothin but a hound doggo. 12/10 https://t.co/QV5nx6otZR
826848821049180160,2017-02-01 17:44:55+00:00,"<a href=""http://twitter.com/download/iphone"" rel=""nofollow"">Twitter for iPhone</a>",This is Cupid. He was found in the trash. Now he's well on his way to prosthetic front legs and a long happy doggo life. 13/10 heroic af https://t.co/WS0Gha8vRh
826598365270007810,2017-02-01 01:09:42+00:00,"<a href=""http://twitter.com/download/iphone"" rel=""nofollow"">Twitter for iPhone</a>",This is Pawnd... James Pawnd. He's suave af. 13/10 would trust with my life https://t.co/YprN62Z74I
826476773533745153,2017-01-31 17:06:32+00:00,"<a href=""http://twitter.com/download/iphone"" rel=""nofollow"">Twitter for iPhone</a>",This is Pilot. He has mastered the synchronized head tilt and sneaky tongue slip. Usually not unlocked until later doggo days. 12/10 https://t.co/YIV8sw8xkh
826240494070030336,2017-01-31 01:27:39+00:00,"<a href=""http://twitter.com/download/iphone"" rel=""nofollow"">Twitter for iPhone</a>",We only rate dogs. Please don't send in any more non-dogs like this Wild Albanian Street Moose. Thank you... 11/10 https://t.co/srXL2s868C
826204788643753985,2017-01-30 23:05:46+00:00,"<a href=""http://twitter.com/download/iphone"" rel=""nofollow"">Twitter for iPhone</a>","Here's a little more info on Dew, your favorite roaming doggo that went h*ckin viral. 13/10 
https://t.co/1httNYrCeW https://t.co/KvaM8j3jhX"
826115272272650244,2017-01-30 17:10:04+00:00,"<a href=""http://twitter.com/download/iphone"" rel=""nofollow"">Twitter for iPhone</a>",This is Ike. He's demonstrating the pupmost restraint. 13/10 super good boy https://t.co/6gHoGah9nm
825876512159186944,2017-01-30 01:21:19+00:00,"<a href=""http://twitter.com/download/iphone"" rel=""nofollow"">Twitter for iPhone</a>",This is Mo. No one will push him around in the grocery cart. He's quite pupset about it. 11/10 I volunteer https://t.co/feNwTq12S5
825829644528148480,2017-01-29 22:15:05+00:00,"<a href=""http://twitter.com/download/iphone"" rel=""nofollow"">Twitter for iPhone</a>",This is Toby. He just found out you only pretend to throw the ball sometimes. H*ckin puppalled. 12/10 would console https://t.co/YimNdkZrhM
825535076884762624,2017-01-29 02:44:34+00:00,"<a href=""http://twitter.com/download/iphone"" rel=""nofollow"">Twitter for iPhone</a>",Here's a very loving and accepting puppo. Appears to have read her Constitution well. 14/10 would pat head approvingly https://t.co/6ao80wIpV1
825147591692263424,2017-01-28 01:04:51+00:00,"<a href=""http://twitter.com/download/iphone"" rel=""nofollow"">Twitter for iPhone</a>",This is Sweet Pea. She hides in shoe boxes and waits for someone to pick her. Then she surpuprises them. 13/10 https://t.co/AyBEmx56MD
825026590719483904,2017-01-27 17:04:02+00:00,"<a href=""http://twitter.com/download/iphone"" rel=""nofollow"">Twitter for iPhone</a>","Say hello to Pablo. He's one gorgeous puppo. A true 12/10. Click the link to see why Pablo requests your assistance

https://t.co/koHvVQp9bL https://t.co/IhW0JKf7kc"
824775126675836928,2017-01-27 00:24:48+00:00,"<a href=""http://twitter.com/download/iphone"" rel=""nofollow"">Twitter for iPhone</a>",This is Scooter. His lack of opposable thumbs is rendering his resistance to tickling embarrassingly moot. 12/10 would keep tickling https://t.co/F0VWg2GztI
824663926340194305,2017-01-26 17:02:56+00:00,"<a href=""http://twitter.com/download/iphone"" rel=""nofollow"">Twitter for iPhone</a>",This is Wilson. Named after the volleyball. He tongue wrestled a bee and lost. 13/10 valiant effort tho https://t.co/A5Mx4h1FSM
824325613288833024,2017-01-25 18:38:36+00:00,"<a href=""http://twitter.com/download/iphone"" rel=""nofollow"">Twitter for iPhone</a>",Retweet the h*ck out of this 13/10 pupper #BellLetsTalk https://t.co/wBmc7OaGvS
824297048279236611,2017-01-25 16:45:05+00:00,"<a href=""http://twitter.com/download/iphone"" rel=""nofollow"">Twitter for iPhone</a>",This is Nala. She got in trouble. One h*ck of a pupnishment. Still 11/10 would pet https://t.co/EmJbG0skLt
823939628516474880,2017-01-24 17:04:50+00:00,"<a href=""http://twitter.com/download/iphone"" rel=""nofollow"">Twitter for iPhone</a>",This is Cash. He's officially given pup on today. 12/10 frighteningly relatable https://t.co/m0hrATIEyw
823699002998870016,2017-01-24 01:08:40+00:00,"<a href=""http://twitter.com/download/iphone"" rel=""nofollow"">Twitter for iPhone</a>",This is Winston. The goggles make him a superhero. Protects the entire city from criminals unless they rub his belly really well. 12/10 https://t.co/yCydYURYEL
823581115634085888,2017-01-23 17:20:14+00:00,"<a href=""http://twitter.com/download/iphone"" rel=""nofollow"">Twitter for iPhone</a>",This is Crawford. He's quite h*ckin good at the selfies. Nose is incredibly boopable. 11/10 would snapchat https://t.co/6F5Rrp472U
823322678127919110,2017-01-23 00:13:17+00:00,"<a href=""http://twitter.com/download/iphone"" rel=""nofollow"">Twitter for iPhone</a>",This is Wyatt. He's got the fastest paws in the West. H*ckin deadly. 11/10 would ride into the sunset with https://t.co/stkJ377KK7
822975315408461824,2017-01-22 01:12:59+00:00,"<a href=""http://twitter.com/download/iphone"" rel=""nofollow"">Twitter for iPhone</a>",This is Albus. He's soaked as h*ck. Seems to have misplaced an ear as well. Still in good spirits tho. 12/10 would dry https://t.co/yUM8jYStuG
822872901745569793,2017-01-21 18:26:02+00:00,"<a href=""http://twitter.com/download/iphone"" rel=""nofollow"">Twitter for iPhone</a>",Here's a super supportive puppo participating in the Toronto  #WomensMarch today. 13/10 https://t.co/nTz3FtorBc
822859134160621569,2017-01-21 17:31:20+00:00,"<a href=""http://twitter.com/download/iphone"" rel=""nofollow"">Twitter for iPhone</a>",This is Hobbes. He was told he was going to the park. Ended up at the vet. H*ckin bamboozled. Quite pupset with you. 12/10 https://t.co/SSQE06XClS
754449512966619136,2016-07-16 22:55:55+00:00,"<a href=""http://twitter.com/download/iphone"" rel=""nofollow"">Twitter for iPhone</a>",This is Dex. He can see into your past and future. Mesmerizing af 11/10 https://t.co/0dYI0Cpdge
754120377874386944,2016-07-16 01:08:03+00:00,"<a href=""http://twitter.com/download/iphone"" rel=""nofollow"">Twitter for iPhone</a>","When you hear your owner say they need to hatch another egg, but you've already been on 17 walks today. 10/10 https://t.co/lFEoGqZ4oA"
753655901052166144,2016-07-14 18:22:23+00:00,"<a href=""http://twitter.com/download/iphone"" rel=""nofollow"">Twitter for iPhone</a>","""The dogtor is in hahahaha no but seriously I'm very qualified and that tumor is definitely malignant"" 10/10 https://t.co/ULqThwWmLg"
753420520834629632,2016-07-14 02:47:04+00:00,"<a href=""http://twitter.com/download/iphone"" rel=""nofollow"">Twitter for iPhone</a>",Here we are witnessing an isolated squad of bouncing doggos. Unbelievably rare for this time of year. 11/10 for all https://t.co/CCdlwiTwQf
753398408988139520,2016-07-14 01:19:12+00:00,"<a href=""http://twitter.com/download/iphone"" rel=""nofollow"">Twitter for iPhone</a>",This is Scout. Her batteries are low. 12/10 precious af https://t.co/ov05LIoQJX
753375668877008896,2016-07-13 23:48:51+00:00,"<a href=""http://twitter.com/download/iphone"" rel=""nofollow"">Twitter for iPhone</a>",This is Hank. He's mischievous af. Doesn't even know what he was trying to do here. 8/10 quit the shit Hank damn https://t.co/3r7wjfsXHc
753294487569522689,2016-07-13 18:26:16+00:00,"<a href=""http://twitter.com/download/iphone"" rel=""nofollow"">Twitter for iPhone</a>",This is Ace. He's a window washer. One of the best around. 11/10 helpful af https://t.co/sTuRoYfzPv
753026973505581056,2016-07-13 00:43:15+00:00,"<a href=""http://twitter.com/download/iphone"" rel=""nofollow"">Twitter for iPhone</a>",Say hello to Tayzie. She's a Barbadian Bugaboop. Seems quite social. A rare quality for a Bugaboop. 10/10 petable af https://t.co/6qF5YZx6OV
752917284578922496,2016-07-12 17:27:23+00:00,"<a href=""http://twitter.com/download/iphone"" rel=""nofollow"">Twitter for iPhone</a>",This is Grizzie. She's a semi-submerged Bahraini Buttersplotch. Appears alert af. Snazzy tongue. 11/10 would def pet https://t.co/WZ4zzkXXnW
752682090207055872,2016-07-12 01:52:49+00:00,"<a href=""http://twitter.com/download/iphone"" rel=""nofollow"">Twitter for iPhone</a>",Nothing better than a doggo and a sunset. 10/10 majestic af https://t.co/xVSodF19PS
752660715232722944,2016-07-12 00:27:52+00:00,"<a href=""http://twitter.com/download/iphone"" rel=""nofollow"">Twitter for iPhone</a>","Hooman used Pokeball
*wiggle*
*wiggle*
Doggo broke free 
10/10 https://t.co/bWSgqnwSHr"
752519690950500352,2016-07-11 15:07:30+00:00,"<a href=""http://twitter.com/download/iphone"" rel=""nofollow"">Twitter for iPhone</a>",Hopefully this puppo on a swing will help get you through your Monday. 11/10 would push https://t.co/G54yClasz2
752334515931054080,2016-07-11 02:51:40+00:00,"<a href=""http://twitter.com/download/iphone"" rel=""nofollow"">Twitter for iPhone</a>",Here's a doggo trying to catch some fish. 8/10 futile af (vid by @KellyBauerx) https://t.co/jwd0j6oWLE
752173152931807232,2016-07-10 16:10:29+00:00,"<a href=""http://twitter.com/download/iphone"" rel=""nofollow"">Twitter for iPhone</a>",This is Brody. He's a lifeguard. Always prepared for rescue. 12/10 would fake drown just to get saved by him https://t.co/olDmwNjOy1
751937170840121344,2016-07-10 00:32:46+00:00,"<a href=""http://twitter.com/download/iphone"" rel=""nofollow"">Twitter for iPhone</a>",This is Ruby. Her ice cube is melting. She doesn't know what to do about it. 11/10 https://t.co/Vfc3eAFl2q
751830394383790080,2016-07-09 17:28:29+00:00,"<a href=""http://twitter.com/download/iphone"" rel=""nofollow"">Twitter for iPhone</a>",This is Tucker. He's very camera shy. 12/10 would give stellar belly rubs to https://t.co/BJRsxuLF1w
751598357617971201,2016-07-09 02:06:27+00:00,"<a href=""http://twitter.com/download/iphone"" rel=""nofollow"">Twitter for iPhone</a>",This is Toby. A cat got his tongue. 13/10 adorable af https://t.co/fHQrBKYSLC
751583847268179968,2016-07-09 01:08:47+00:00,"<a href=""http://twitter.com/download/iphone"" rel=""nofollow"">Twitter for iPhone</a>",Please stop sending it pictures that don't even have a doggo or pupper in them. Churlish af. 5/10 neat couch tho https://t.co/u2c9c7qSg8
751538714308972544,2016-07-08 22:09:27+00:00,"<a href=""http://twitter.com/download/iphone"" rel=""nofollow"">Twitter for iPhone</a>",This is Max. She has one ear that's always slightly more alert than the other. 10/10 wonky af https://t.co/5eJg69G8vY
751456908746354688,2016-07-08 16:44:23+00:00,"<a href=""http://twitter.com/download/iphone"" rel=""nofollow"">Twitter for iPhone</a>",Here's a pupper that's very hungry but too lazy to get up and eat. 12/10 (vid by @RealDavidCortes) https://t.co/lsVAMBq6ex
751251247299190784,2016-07-08 03:07:09+00:00,"<a href=""http://twitter.com/download/iphone"" rel=""nofollow"">Twitter for iPhone</a>",This is Gilbert. He's being chased by a battalion of miniature floof cows. 10/10 we all believe in you Gilbert https://t.co/wayKZkDRTG
751205363882532864,2016-07-08 00:04:50+00:00,"<a href=""http://twitter.com/download/iphone"" rel=""nofollow"">Twitter for iPhone</a>","""This photographer took pics of her best friend before and after she told them they were beautiful"" 12/10 https://t.co/510gJW9fsy"
751132876104687617,2016-07-07 19:16:47+00:00,"<a href=""http://twitter.com/download/iphone"" rel=""nofollow"">Twitter for iPhone</a>",This is Cooper. He's just so damn happy. 10/10 what's your secret puppo? https://t.co/yToDwVXEpA
750868782890057730,2016-07-07 01:47:22+00:00,"<a href=""http://twitter.com/download/iphone"" rel=""nofollow"">Twitter for iPhone</a>",Meet Milo. He hauled ass until he ran out of treadmill and then passed out from exhaustion. 11/10 sleep tight pupper https://t.co/xe1aGZNkcC
750719632563142656,2016-07-06 15:54:42+00:00,"<a href=""http://twitter.com/download/iphone"" rel=""nofollow"">Twitter for iPhone</a>",This is Meyer. He has to hold somebody's hand during car rides. He's also wearing a seatbelt. 12/10 responsible af https://t.co/WS6BoApYyL
750506206503038976,2016-07-06 01:46:38+00:00,"<a href=""http://twitter.com/download/iphone"" rel=""nofollow"">Twitter for iPhone</a>",This is Malcolm. He's absolutely terrified of heights. 8/10 hang in there pupper https://t.co/SVU00Sc9U2
750429297815552001,2016-07-05 20:41:01+00:00,"<a href=""http://twitter.com/download/iphone"" rel=""nofollow"">Twitter for iPhone</a>",This is Arnie. He's a Nova Scotian Fridge Floof. Rare af. 12/10 https://t.co/lprdOylVpS
750383411068534784,2016-07-05 17:38:41+00:00,"<a href=""http://twitter.com/download/iphone"" rel=""nofollow"">Twitter for iPhone</a>",This is Zoe. She was trying to stealthily take a picture of you but you just noticed. 9/10 not so sneaky pupper https://t.co/FfH3o88Vta
750147208377409536,2016-07-05 02:00:06+00:00,"<a href=""http://twitter.com/download/iphone"" rel=""nofollow"">Twitter for iPhone</a>","And finally, happy 4th of July from the squad ðŸ‡ºðŸ‡¸ 13/10 for all https://t.co/Mr8Lr3iOUe"
750132105863102464,2016-07-05 01:00:05+00:00,"<a href=""http://twitter.com/download/iphone"" rel=""nofollow"">Twitter for iPhone</a>",This is Stewie. He will roundhouse kick anyone who questions his independence. 11/10 free af https://t.co/dDx2gKefYo
750117059602808832,2016-07-05 00:00:18+00:00,"<a href=""http://twitter.com/download/iphone"" rel=""nofollow"">Twitter for iPhone</a>",This is Calvin. He just loves America so much. 10/10 would roll around in flag with https://t.co/RXdzWaCQHm
750101899009982464,2016-07-04 23:00:03+00:00,"<a href=""http://twitter.com/download/iphone"" rel=""nofollow"">Twitter for iPhone</a>",Meet Lilah. She agreed on one quick pic. Now she'd like to go mentally prepare for the onslaught of fireworks. 11/10 https://t.co/enCpXzZHkD
750086836815486976,2016-07-04 22:00:12+00:00,"<a href=""https://about.twitter.com/products/tweetdeck"" rel=""nofollow"">TweetDeck</a>",This is Spanky. He was a member of the 2002 USA Winter Olympic speed skating team. Accomplished af. 12/10 https://t.co/7tlZPrePXd
750071704093859840,2016-07-04 21:00:04+00:00,"<a href=""http://twitter.com/download/iphone"" rel=""nofollow"">Twitter for iPhone</a>",Pause your cookout and admire this pupper's nifty hat. 10/10 https://t.co/RG4C9IdNJM
750056684286914561,2016-07-04 20:00:23+00:00,"<a href=""https://about.twitter.com/products/tweetdeck"" rel=""nofollow"">TweetDeck</a>",This is Jameson. He had a few too many in the name of freedom. I can't not respect that. 11/10 'Merica https://t.co/8zQvXM6pG5
750041628174217216,2016-07-04 19:00:33+00:00,"<a href=""https://about.twitter.com/products/tweetdeck"" rel=""nofollow"">TweetDeck</a>",This is Beau. He's trying to keep his daddy from packing to leave for Annual Training. 13/10 and now I'm crying https://t.co/7JeDfQvzzI
750026558547456000,2016-07-04 18:00:41+00:00,"<a href=""https://about.twitter.com/products/tweetdeck"" rel=""nofollow"">TweetDeck</a>",Meet Jax &amp; Jil. Jil is yelling the pledge of allegiance. If u cant take the freedom get out the kitchen Jax. 10/10s https://t.co/jrg29NDNhI
750011400160841729,2016-07-04 17:00:26+00:00,"<a href=""https://about.twitter.com/products/tweetdeck"" rel=""nofollow"">TweetDeck</a>",Meet Piper. She's an airport doggo. Please return your tray table to its full pupright and locked position. 11/10 https://t.co/D17IAcetmM
749996283729883136,2016-07-04 16:00:22+00:00,"<a href=""https://about.twitter.com/products/tweetdeck"" rel=""nofollow"">TweetDeck</a>",This is Bo. He emanates happiness. 12/10 I could cut the freedom with a knife https://t.co/c7LNFt39eR
749981277374128128,2016-07-04 15:00:45+00:00,"<a href=""https://about.twitter.com/products/tweetdeck"" rel=""nofollow"">TweetDeck</a>",This is Atticus. He's quite simply America af. 1776/10 https://t.co/GRXwMxLBkh
749774190421639168,2016-07-04 01:17:51+00:00,"<a href=""http://twitter.com/download/iphone"" rel=""nofollow"">Twitter for iPhone</a>",This is Lucy. She's a Benebop Cumberplop. 12/10 would hold against my face https://t.co/4yXa801fgl
749417653287129088,2016-07-03 01:41:06+00:00,"<a href=""http://twitter.com/download/iphone"" rel=""nofollow"">Twitter for iPhone</a>",This is Finn. He's the most unphotogenic pupper of all time. 11/10 https://t.co/qvA2rCUl6v
749403093750648834,2016-07-03 00:43:15+00:00,"<a href=""http://twitter.com/download/iphone"" rel=""nofollow"">Twitter for iPhone</a>",Duuun dun... duuun dun... dunn  dun. dunn dun. dun dun dun dun dun dun dun dun dun dun dun dun dun dun dun. 10/10 https://t.co/9qdJ2Q1Cwx
749395845976588288,2016-07-03 00:14:27+00:00,"<a href=""http://twitter.com/download/iphone"" rel=""nofollow"">Twitter for iPhone</a>",This is George. He just remembered that bees are dying globally at an alarming rate. Scary stuff George. 10/10 https://t.co/lznl6QGkYc
749317047558017024,2016-07-02 19:01:20+00:00,"<a href=""http://twitter.com/download/iphone"" rel=""nofollow"">Twitter for iPhone</a>",This is Blu. He's a wild bush Floofer. I wish anything made me as happy as bushes make Blu. 12/10 would frolic with https://t.co/HHUAnBb6QB
749064354620928000,2016-07-02 02:17:13+00:00,"<a href=""http://twitter.com/download/iphone"" rel=""nofollow"">Twitter for iPhone</a>",Meet Winston. He's pupset because I forgot to mention that it's Canada Day today. 11/10 please forgive me Winston https://t.co/xEY8dbJxnF
749036806121881602,2016-07-02 00:27:45+00:00,"<a href=""http://twitter.com/download/iphone"" rel=""nofollow"">Twitter for iPhone</a>",This is Dietrich. He hops at random. Other doggos don't understand him. It upsets him greatly. 8/10 would comfort https://t.co/U8cSRz8wzC
748977405889503236,2016-07-01 20:31:43+00:00,"<a href=""http://twitter.com/download/iphone"" rel=""nofollow"">Twitter for iPhone</a>",What jokester sent in a pic without a dog in it? This is not @rock_rates. This is @dog_rates. Thank you ...10/10 https://t.co/nDPaYHrtNX
748932637671223296,2016-07-01 17:33:49+00:00,"<a href=""http://twitter.com/download/iphone"" rel=""nofollow"">Twitter for iPhone</a>",Say hello to Divine Doggo. Must be magical af. 13/10 would be an honor to pet https://t.co/BbcABzohKb
748705597323898880,2016-07-01 02:31:39+00:00,"<a href=""http://twitter.com"" rel=""nofollow"">Twitter Web Client</a>",#BarkWeek is getting rather heckin terrifying over here. Doin me quite the spooken. 13/10 (vid by @corgi_zero) https://t.co/eA7k1ZQslA
748699167502000129,2016-07-01 02:06:06+00:00,"<a href=""http://twitter.com/download/iphone"" rel=""nofollow"">Twitter for iPhone</a>",Meet Tripp. He's being eaten by a sherk and doesn't even care. Unfazed af. 11/10 keep doin you Tripp https://t.co/gGxjthmG1c
748692773788876800,2016-07-01 01:40:41+00:00,"<a href=""http://twitter.com/download/iphone"" rel=""nofollow"">Twitter for iPhone</a>",That is Quizno. This is his beach. He does not tolerate human shenanigans on his beach. 10/10 reclaim ur land doggo https://t.co/vdr7DaRSa7
748575535303884801,2016-06-30 17:54:50+00:00,"<a href=""http://twitter.com/download/iphone"" rel=""nofollow"">Twitter for iPhone</a>",This is one of the most reckless puppers I've ever seen. How she got a license in the first place is beyond me. 6/10 https://t.co/z5bAdtn9kd
748568946752774144,2016-06-30 17:28:39+00:00,"<a href=""http://twitter.com/download/iphone"" rel=""nofollow"">Twitter for iPhone</a>",This is Cora. She rings a bell for treats. 12/10 precious af (vid by @skyehellenkamp) https://t.co/uUncaAGH18
748346686624440324,2016-06-30 02:45:28+00:00,"<a href=""http://twitter.com/download/iphone"" rel=""nofollow"">Twitter for iPhone</a>","""So... we meat again"" (I'm so sorry for that pun I couldn't resist pls don't unfollow) 10/10 https://t.co/XFBrrqapZa"
748324050481647620,2016-06-30 01:15:31+00:00,"<a href=""http://twitter.com/download/iphone"" rel=""nofollow"">Twitter for iPhone</a>",This is Duke. He permanently looks like he just tripped over something. 11/10 https://t.co/1sNtG7GgiO
748307329658011649,2016-06-30 00:09:04+00:00,"<a href=""http://twitter.com/download/iphone"" rel=""nofollow"">Twitter for iPhone</a>","This sherk must've leapt out of the water and into the canoe, trapping the human. Won't even help paddle smh. 7/10 https://t.co/KubWEqOIgO"
747963614829678593,2016-06-29 01:23:16+00:00,"<a href=""http://twitter.com/download/iphone"" rel=""nofollow"">Twitter for iPhone</a>",PUPPER NOOOOO BEHIND YOUUU 10/10 pls keep this pupper in your thoughts https://t.co/ZPfeRtOX0Q
747933425676525569,2016-06-28 23:23:19+00:00,"<a href=""http://twitter.com/download/iphone"" rel=""nofollow"">Twitter for iPhone</a>",Pls don't send more sherks. I don't care how seemingly floofy they are. It does me so much frighten. Thank u. 11/10 https://t.co/oQqlOsla4R
747885874273214464,2016-06-28 20:14:22+00:00,"<a href=""http://twitter.com/download/iphone"" rel=""nofollow"">Twitter for iPhone</a>",This is a mighty rare blue-tailed hammer sherk. Human almost lost a limb trying to take these. Be careful guys. 8/10 https://t.co/TGenMeXreW
747844099428986880,2016-06-28 17:28:22+00:00,"<a href=""http://twitter.com/download/iphone"" rel=""nofollow"">Twitter for iPhone</a>",This is Huxley. He's pumped for #BarkWeek. Even has a hat. Ears are quite magical. 11/10 would remove hat to pat https://t.co/V7h5NMYbYz
747816857231626240,2016-06-28 15:40:07+00:00,"<a href=""http://twitter.com/download/iphone"" rel=""nofollow"">Twitter for iPhone</a>",Viewer discretion is advised. This is a terrible attack in progress. Not even in water (tragic af). 4/10 bad sherk https://t.co/L3U0j14N5R
747600769478692864,2016-06-28 01:21:27+00:00,"<a href=""http://twitter.com/download/iphone"" rel=""nofollow"">Twitter for iPhone</a>",This is Bookstore and Seaweed. Bookstore is tired and Seaweed is an asshole. 10/10 and 7/10 respectively https://t.co/eUGjGjjFVJ
747594051852075008,2016-06-28 00:54:46+00:00,"<a href=""http://twitter.com/download/iphone"" rel=""nofollow"">Twitter for iPhone</a>",Again w the sharks guys. This week is about dogs ACTING or DRESSING like sharks. NOT actual sharks. Thank u ...11/10 https://t.co/Ie2mWXWjpr
747512671126323200,2016-06-27 19:31:23+00:00,"<a href=""http://twitter.com/download/iphone"" rel=""nofollow"">Twitter for iPhone</a>",Guys pls stop sending actual sharks. It's too dangerous for me and the people taking the photos. Thank you ...10/10 https://t.co/12lICZN2SP
747461612269887489,2016-06-27 16:08:30+00:00,"<a href=""http://twitter.com/download/iphone"" rel=""nofollow"">Twitter for iPhone</a>",Never seen a shark hold another shark like this before. Must be evolving. Both 10/10 please only send dogs though https://t.co/x4IUNKV79Y
747219827526344708,2016-06-27 00:07:44+00:00,"<a href=""http://twitter.com/download/iphone"" rel=""nofollow"">Twitter for iPhone</a>",This is Atticus. He's remaining calm but his costume looks terrified. 11/10 https://t.co/uT7QeZI34U
747204161125646336,2016-06-26 23:05:29+00:00,"<a href=""http://twitter.com/download/iphone"" rel=""nofollow"">Twitter for iPhone</a>",This is Clark. He's deadly af. Clearly part shark (see pic 2). 10/10 would totally still try to pet https://t.co/dmdEBOEctC
747103485104099331,2016-06-26 16:25:26+00:00,"<a href=""http://twitter.com/download/iphone"" rel=""nofollow"">Twitter for iPhone</a>","Guys... I said DOGS with ""shark qualities"" or ""costumes."" Not actual sharks. This did me a real frighten ...11/10 https://t.co/DX1JUHJVN7"
746872823977771008,2016-06-26 01:08:52+00:00,"<a href=""http://twitter.com/download/iphone"" rel=""nofollow"">Twitter for iPhone</a>",This is a carrot. We only rate dogs. Please only send in dogs. You all really should know this by now ...11/10 https://t.co/9e48aPrBm2
746790600704425984,2016-06-25 19:42:08+00:00,"<a href=""http://twitter.com/download/iphone"" rel=""nofollow"">Twitter for iPhone</a>",When you just can't resist... 10/10 topnotch tongue https://t.co/jeWEGUgbXf
